url,title,author,date
https://www.kshb.com/best-waist-trainer-women-do-they-work,What is a waist trainer—and do they actually work?,Kathleen St. John,"10:20 AM, May 09, 2022 "
https://www.kshb.com/news/national/california-lawyer-michael-avenatti-faces-sentencing-apologizes-to-stormy-daniels,"Avenatti, facing sentencing, apologizes to Stormy Daniels",The Associated Press,"6:10 PM, May 20, 2022 "
https://www.kshb.com/National/newsy/afghan-refugee-journalist-highlights-other-refugees-now-in-the-u-s,Afghan journalist highlights refugees,Scripps News Staff,"2:35 PM, May 17, 2022 "
https://www.kshb.com/news/national/ex-trump-adviser-peter-navarro-subpoenaed-in-dojs-1-6-probe,Ex-Trump adviser Peter Navarro subpoenaed in DOJ's 1/6 probe,The Associated Press & Scripps National,"6:18 PM, May 31, 2022 "
https://www.kshb.com/news/national/turn-yourself-in-murder-of-pregnant-woman-childs-father-leaves-residents-angry,"'Turn yourself in': Murder of pregnant woman, child's father leaves residents angry",WMAR Staff,"9:22 PM, May 13, 2022 "
https://www.kshb.com/news/national/recession-fears-mount-as-wall-street-stocks-slip-near-a-bear-market,"Stocks on Wall Street slip, nearing bear market",Scripps News Staff,"7:42 PM, May 19, 2022 "
https://www.kshb.com/20-device-repels-mosquitoes-without-sprays-candles,"This under-$20 device repels mosquitoes without sprays, candles or flames",Kathleen St. John,"6:30 AM, May 16, 2022 "
https://www.kshb.com/sports/college-sports/ku/agbaji-leads-no-6-ku-past-tcu-75-62-in-big-12-semifinals,Agbaji leads No. 6 KU past TCU 75-62 in Big 12 semifinals,"Dave Skretta, AP Sports Writer","10:13 PM, Mar 11, 2022 "
https://www.kshb.com/news/national/florida-elementary-school-chess-team-unbeatable,Florida elementary school chess team unbeatable,WPTV Staff,"1:19 PM, May 18, 2022 "
https://www.kshb.com/news/national/1-hiker-dead-1-hurt-after-waves-inundate-california-trail,"1 hiker dead, 1 hurt after waves inundate California trail",The Associated Press & Scripps National,"4:28 PM, May 31, 2022 "
https://www.kshb.com/news/national/wisconsin-couple-kills-bear-that-attacked-them-in-their-home,Wisconsin couple kills bear that attacked them in their home,The Associated Press & Scripps National,"2:19 PM, May 23, 2022 "
https://www.kshb.com/weather/snow-will-accumulate-quickly-this-morning-and-lead-to-hazardous-conditions,Accumulating snowfall slowly ends overnight,Wes Peery,"2:49 AM, Mar 10, 2022 "
https://www.kshb.com/news/national/new-study-maps-digital-access-to-food-across-the-u-s-how-delivery-apps-can-help-in-food-deserts,Food delivery apps present possibility for food deserts ,Chloe Nordquist,"8:55 AM, May 18, 2022 "
https://www.kshb.com/entertainment/38-the-spot-kmci/nextgen-tv,NextGen TV: What you need to know,,"1:46 PM, Aug 20, 2021 "
https://www.kshb.com/National/newsy/more-investors-buying-mobile-home-parks-leaving-residents-behind,More investors buying mobile home parks,Scripps News Staff,"3:20 PM, May 18, 2022 "
https://www.kshb.com/news/crime/leavenworth-man-police-shot-arrested-after-hospital-release,Leavenworth man police shot arrested after hospital release,Associated Press,"11:56 AM, Feb 24, 2022 "
https://www.kshb.com/news/national/mexico-totally-bans-sales-of-e-cigarettes,Mexico bans all sales of e-cigarettes,The Associated Press & Scripps National,"2:59 PM, May 31, 2022 "
https://www.kshb.com/weather/weather-blog-a-run-at-80-one-day-out-of-the-next-ten,Weather Blog: Run at 80° 1 day out of next 10,Jeff Penner,"8:27 AM, Mar 26, 2022 "
https://www.kshb.com/news/national/users-in-texas-illinois-can-no-longer-use-certain-filters-on-instagram-and-facebook,"Some social media filters banned in Texas, Illinois",Scripps National,"10:07 AM, May 12, 2022 "
https://www.kshb.com/news/national/pandemic-era-trend-allows-some-to-stretch-their-dollars-further,Pandemic-era trend allows some to stretch their dollars,Dan Grossman,"4:50 PM, May 12, 2022 "
https://www.kshb.com/human-skull-minnesota-river-8000-years-old,"Kayakers Found A Human Skull That Turned Out To Be 8,000 Years Old",Kaitlin Gates,"3:50 PM, May 20, 2022 "
https://www.kshb.com/news/local-news/love-advice-from-experts-kansas-citians,"Love advice from experts, Kansas Citians ",Megan Abundis,"9:38 PM, Feb 11, 2022 "
https://www.kshb.com/monkey-coffee-cocktail-recipe-dessert,"Monkey Coffee Is A Delightful Combo Of Coffee, Booze And Dessert",Kate Emswiler,"11:00 AM, May 05, 2022 "
https://www.kshb.com/news/local-news/ukrainian-musician-records-performance-after-illuminated-union-station-receives-global-support,Ukrainian musician performs Sunday at Union Station,Addi Weakley,"11:03 PM, Feb 27, 2022 "
https://www.kshb.com/science-why-zero-gravity-chairs-make-you-feel-weightless,The science behind zero-gravity chairs and why they make you feel weightless,Emily O'Brien,"8:45 AM, May 13, 2022 "
https://www.kshb.com/news/national/coronavirus/fda-authorizes-at-home-nonprescription-test-that-detects-covid-19-rsv-and-flu,FDA authorizes nonprescription test that detects 3 viruses,Scripps National,"10:05 AM, May 18, 2022 "
https://www.kshb.com/news/black-history-month/black-archives-of-mid-america-preserves-black-history-in-kansas-city,Black Archives of Mid-America preserves Black history in KC,Leslie DelasBour,"5:52 PM, Feb 28, 2022 "
https://www.kshb.com/sports/chiefs-release-lb-anthony-hitchens-to-cap-clearing-move,Chiefs release LB Anthony Hitchens in cap-clearing move,Tod Palmer,"2:18 PM, Feb 22, 2022 "
https://www.kshb.com/how-often-you-should-change-windshield-wipers,Here’s how often you should be changing your windshield wipers,Emily O'Brien,"2:35 PM, May 19, 2022 "
https://www.kshb.com/news/national/ex-cop-thomas-lane-pleads-guilty-to-manslaughter-in-george-floyds-death,Ex-cop pleads guilty to manslaughter in George Floyd’s death,The Associated Press & Scripps National,"8:48 AM, May 18, 2022 "
https://www.kshb.com/sports/college-sports/ku/ku-basketball-announces-death-of-former-forward-bill-lienhard,KU bball announces death of former forward Bill Lienhard ,David Medina,"4:34 PM, Feb 09, 2022 "
https://www.kshb.com/news/local-news/1-dead-after-single-vehicle-crash-tuesday,1 dead after single-vehicle crash Tuesday ,Addi Weakley,"3:34 PM, Mar 12, 2022 "
https://www.kshb.com/news/national/man-who-won-10m-lottery-is-sentenced-to-life-in-prison-for-murder,Lottery winner sentenced to life in prison for murder,Scripps National,"11:41 AM, May 31, 2022 "
https://www.kshb.com/news/crime/independence-police-pursue-alleged-armed-robbery-suspects-into-south-kansas-city-missouri,Independence police pursue suspects into KCMO,Addi Weakley,"7:31 PM, Feb 26, 2022 "
https://www.kshb.com/sports/college-sports/ku/kus-agbaji-named-big-12s-best-ksus-pack-also-on-1st-team,KU's Agbaji named Big 12's best; KSU's Pack also on 1st team,Mick Shaffer,"10:57 PM, Mar 06, 2022 "
https://www.kshb.com/news/national/marylands-sen-chris-van-hollen-treated-for-minor-stroke,Maryland's Sen. Chris Van Hollen treated for minor stroke,The Associated Press & Scripps National,"1:34 PM, May 16, 2022 "
https://www.kshb.com/sports/college-sports/ku/warren-corman-is-the-last-living-architect-of-iconic-allen-fieldhouse,Warren Corman is last living architect of Allen Fieldhouse,McKenzie Nelson,"3:00 PM, Mar 10, 2022 "
https://www.kshb.com/news/national/russia-ukraine-conflict/us-accuses-russia-of-weaponizing-food-in-ukraine-war,US accuses Russia of weaponizing food in Ukraine war,The Associated Press & Scripps National,"9:44 PM, May 19, 2022 "
https://www.kshb.com/news/local-news/man-posts-good-bad-and-ugly-of-bicycling-in-kcmo-on-twitter,"Man posts good, bad and ugly of bicycling in KCMO on Twitter",Charlie Keegan,"4:00 AM, Feb 16, 2022 "
https://www.kshb.com/news/local-news/missouri-house-budget-committee-oks-tax-break,Missouri House budget committee OKs tax break,Associated Press,"9:11 PM, Apr 19, 2022 "
https://www.kshb.com/news/local-news/independence-man-killed-in-monday-crash-on-us-69,Independence man killed in Monday crash on US 69,Katelyn Brown,"6:45 AM, Apr 05, 2022 "
https://www.kshb.com/news/local-news/judicial-panel-unveils-tentative-new-map-for-missouri-senate,Judicial panel unveils tentative new map for Missouri Senate ,Associated Press,"4:46 PM, Mar 14, 2022 "
https://www.kshb.com/new-fcc-rules-stops-robocalls-other-countries,New FCC Rules Are Designed To Stop Robocalls Coming From Other Countries,Tricia Goss,"8:25 AM, May 20, 2022 "
https://www.kshb.com/news/local-news/business-economic-leaders-celebrate-kcps-accreditation,"Business, economic leaders celebrate KCPS accreditation",Dan Cohen,"7:38 PM, Jan 12, 2022 "
https://www.kshb.com/nasa-grew-plants-lunar-soil-first-time,NASA Grew Plants In Soil From The Moon For The First Time Ever,Kaitlin Gates,"9:55 AM, May 13, 2022 "
https://www.kshb.com/news/national/nypd-seeks-publics-help-in-search-for-nyc-subway-shooter,NYPD seeks public’s help in search for NYC subway shooter,Sarah Dewberry,"1:03 PM, May 23, 2022 "
https://www.kshb.com/news/national/study-shows-ai-deep-learning-models-can-detect-race-in-medical-imaging,AI can 'see' things we can’t in medical imaging,Chloe Nordquist,"5:57 PM, May 24, 2022 "
https://www.kshb.com/news/national/scientists-study-impact-rooftop-gardens-have-on-surface-temperature,Studying impact of rooftop gardens on surface temperature,Ash-har Quraishi,"9:46 AM, May 10, 2022 "
https://www.kshb.com/news/national/president-biden-to-offer-condolences-in-buffalo-following-mass-shooting,"Biden calls Buffalo shooting 'murderous, racist rampage'",Justin Boggs,"6:48 AM, May 17, 2022 "
https://www.kshb.com/news/local-news/kcpd-looking-for-family-of-small-boy-found-alone-monday-morning,KCPD locates family of small boy found alone Monday morning,Katelyn Brown,"5:36 AM, Feb 28, 2022 "
https://www.kshb.com/news/national/fbi-isis-operative-in-u-s-allegedly-plotted-to-assassinate-george-w-bush,FBI: ISIS operative in U.S. allegedly plotted to assassinate George W. Bush,Sarah Dewberry,"2:12 PM, May 24, 2022 "
https://www.kshb.com/fiver-birthday-parties-kids-cut-costs-clutter,‘Fiver’ Birthday Parties For Kids Are A Great Way To Cut Costs And Clutter,Bridget Sharkey,"8:15 AM, May 13, 2022 "
https://www.kshb.com/sports/college-sports/ku/texas-storms-the-court-after-beating-kansas-79-76,"Texas storms the court after beating Kansas, 79-76",Associated Press,"11:50 PM, Feb 07, 2022 "
https://www.kshb.com/National/newsy/karine-jean-pierre-takes-over-as-new-white-house-press-secretary,New White House press secretary takes over,Scripps News Staff,"2:51 PM, May 16, 2022 "
https://www.kshb.com/news/national/sweden-joins-finland-in-asking-for-nato-membership,Sweden joins Finland in asking for NATO membership,Justin Boggs,"8:20 AM, May 16, 2022 "
https://www.kshb.com/news/national-politics/the-race/cyber-attacks-could-be-the-next-big-threat-to-the-supply-chain,Cyber attacks could be the next threat to the supply chain ,Chris Conte,"2:07 PM, May 20, 2022 "
https://www.kshb.com/news/national/coronavirus/congressional-report-biotech-lab-hid-evidence-of-contaminated-vaccine-doses,Biotech lab hid evidence of contaminated vaccine doses,Scripps National,"9:07 AM, May 10, 2022 "
https://www.kshb.com/news/local-news/def-leppard-motley-crue-announce-rescheduled-kansas-city-tour-date,"Def Leppard, Mötley Crüe announce rescheduled KC tour date",Tod Palmer,"12:22 PM, Feb 17, 2022 "
https://www.kshb.com/news/local-news/olathe-family-reacts-to-lawmaker-push-to-help-ukrainian-adoptions,Family reacts to lawmaker push to help Ukrainian adoptions,Emma James,"2:19 PM, Mar 25, 2022 "
https://www.kshb.com/news/national/carnival-cruise-ship-catches-fire-in-turks-caicos,Carnival cruise ship catches fire in Turks & Caicos,WFTS Staff,"1:25 PM, May 26, 2022 "
https://www.kshb.com/sports/nfl-owners-approve-rule-change-for-ot-in-playoffs,NFL owners approve rule change for OT in playoffs,The Associated Press & Scripps National,"12:32 PM, Mar 29, 2022 "
https://www.kshb.com/news/national/why-scientists-believe-this-summer-will-be-warmer-than-usual,Why scientists believe this summer will be warmer than usual,Justin Boggs,"12:39 PM, May 20, 2022 "
https://www.kshb.com/news/local-news/kcpd-seeks-help-to-locate-missing-10-year-old,KCPD locates missing 10-year-old,Tod Palmer,"10:17 AM, Feb 17, 2022 "
https://www.kshb.com/sports/college-sports/mu/blue-valleys-aidan-shaw-recommits-to-university-of-missouri-basketball,Blue Valley's Aidan Shaw recommits to Mizzou basketball ,David Medina,"3:22 PM, Apr 06, 2022 "
https://www.kshb.com/couple-woke-strange-dog-their-bed,Couple Woke Up To A Stranger In Their Bed—A Dog That Wasn’t Theirs,Tricia Goss,"5:30 AM, May 20, 2022 "
https://www.kshb.com/news/national/trump-loses-appeal-must-testify-in-new-york-civil-probe,"Trump loses appeal, must testify in New York civil probe",The Associated Press & Scripps National,"10:43 AM, May 26, 2022 "
https://www.kshb.com/news/local-news/good-samaritan-christian-center-working-to-replace-stolen-items-after-theft,KC-area church raising money to replace stolen items,Addi Weakley,"10:09 PM, Mar 11, 2022 "
https://www.kshb.com/news/national/us-reckoning-with-role-in-native-american-boarding-schools-investigating-the-issue,US reckoning with role in Native American boarding schools,The Associated Press & Scripps National,"6:06 PM, May 12, 2022 "
https://www.kshb.com/news/national/russia-ukraine-conflict/senate-approves-40-billion-in-additional-ukraine-aid,Senate approves $40 billion in additional Ukraine aid,Justin Boggs,"12:36 PM, May 19, 2022 "
https://www.kshb.com/news/national/could-airlines-offer-subscription-passes-one-airline-gives-it-a-try,Could airlines offer subscription passes?,Scripps National,"9:02 AM, May 24, 2022 "
https://www.kshb.com/sports/local-sports/high-school/kansas-city-high-school-football-podcast-week-4,Kansas City High School Football Podcast: Week 4,KSHB 41 Sports,"11:21 AM, Sep 16, 2021 "
https://www.kshb.com/news/national/martin-shkreli-pharma-bro-released-early-from-federal-prison,Martin Shkreli: 'Pharma bro' released early from federal prison,Sarah Dewberry,"2:27 PM, May 18, 2022 "
https://www.kshb.com/news/national/kevin-spacey-charged-with-4-counts-of-sexual-assault-in-the-uk,Spacey charged with 4 counts of sexual assault in the UK,Scripps National,"9:45 AM, May 26, 2022 "
https://www.kshb.com/entertainment/moss-testifies-in-defamation-trial-that-depp-never-pushed-her-down-stairs,Moss testifies Depp never pushed her down stairs,Sarah Dewberry,"5:08 PM, May 26, 2022 "
https://www.kshb.com/news/national/suspect-who-crashed-van-onto-florida-school-campus-shot-killed-by-police,"Suspect who crashed van onto Florida school campus shot, killed by police",WPTV Staff,"9:27 PM, May 13, 2022 "
https://www.kshb.com/news/black-history-month/radd-family-land-and-legacy-once-lost-now-found,"Radd family land and legacy once lost, now found",Dia Wall,"5:00 AM, Feb 28, 2022 "
https://www.kshb.com/news/local-news/kansas-city-missouri-police-ask-for-help-to-find-missing-woman,"Kansas City, Missouri, police locate find missing woman",Steve Kaut,"5:20 PM, Aug 23, 2021 "
https://www.kshb.com/sports/kansas-city-royals-receive-mlb-award-for-philanthropic-excellence,KC Royals receive MLB award for philanthropic excellence,Katelyn Brown,"8:00 AM, Nov 19, 2021 "
https://www.kshb.com/news/national/tough-farming-conditions-and-supply-chain-issues-creating-potato-shortage-and-price-hike,Drought and supply chain issues create potato price hike,Alexa Liacko,"11:25 AM, May 09, 2022 "
https://www.kshb.com/news/national/palestinians-say-israel-deliberately-killed-palestinian-american-al-jazeera-reporter,Palestinians: Israel deliberately killed Palestinian-American reporter,The Associated Press & Scripps National,"2:57 PM, May 26, 2022 "
https://www.kshb.com/news/national/food-nostalgia-more-snack-companies-embrace-old-concepts-in-new-products,Snack companies embrace nostalgia in new products,Joseph Peters,"2:34 PM, May 26, 2022 "
https://www.kshb.com/news/national/russia-ukraine-conflict/us-says-russia-planning-to-annex-large-portions-of-eastern-ukraine,US: Russia planning to annex parts of eastern Ukraine,The Associated Press & Scripps National,"9:25 PM, May 02, 2022 "
https://www.kshb.com/news/local-news/thousands-attend-38th-annual-snake-saturday-parade-in-north-kansas-city,Thousands attend 38th annual Snake Saturday Parade in NKC,JuYeon Kim,"5:15 PM, Mar 12, 2022 "
https://www.kshb.com/news/national/woman-shares-messages-of-love-with-drivers-passersby,Woman shares messages of love with drivers,WTVR Staff,"10:32 AM, May 12, 2022 "
https://www.kshb.com/sports/sporting-kc/sporting-kcs-goal-in-2022-end-4-year-trophy-drought,Sporting KC’s goal in 2022: End 4-year trophy drought,Tod Palmer,"8:00 AM, Mar 11, 2022 "
https://www.kshb.com/weather/weather-blog-sunshine-returns-a-look-into-next-weeks-storm,Weather Blog - Sunshine returns & a look into next week's storm!,Gary Lezak,"6:56 AM, Mar 25, 2022 "
https://www.kshb.com/news/local-news/missouri-supreme-court-weighs-publicly-funded-advocacy-ban,Missouri Supreme Court weighs publicly funded advocacy ban ,Associated Press,"3:25 PM, Nov 02, 2021 "
https://www.kshb.com/news/national/cross-border-drug-tunnel-discovered-stretching-from-tijuana-to-san-diego,Cross-border drug tunnel discovered in San Diego,KGTV Staff,"8:43 AM, May 17, 2022 "
https://www.kshb.com/news/national/russian-soldier-pleads-guilty-at-ukraine-war-crimes-trial,Russian soldier pleads guilty at Ukraine war crimes trial,The Associated Press & Scripps National,"8:49 AM, May 18, 2022 "
https://www.kshb.com/news/crime/18-year-old-charged-in-olathe-east-shooting,18-year-old charged in Olathe East shooting,Sam Hartle,"1:49 PM, Mar 05, 2022 "
https://www.kshb.com/news/national/number-of-possible-ufo-encounters-increased-to-400-according-to-pentagon-report,Number of possible UFO encounters increased to 400,The Associated Press & Scripps National,"2:04 PM, May 17, 2022 "
https://www.kshb.com/news/local-news/one-year-after-the-kansas-city-t-bones-baseball-team-became-the-monarchs,One year after baseball team T-Bones became the Monarchs,Ryan Takeo,"5:04 PM, Feb 23, 2022 "
https://www.kshb.com/news/national/meta-owned-whatsapp-adds-messaging-tools-to-attract-businesses,WhatsApp adds messaging tools to attract businesses,The Associated Press,"3:40 PM, May 19, 2022 "
https://www.kshb.com/news/national/russia-ukraine-conflict/ukraine-takes-political-path-to-qualifying-for-world-cup,Ukraine takes political path to qualifying for World Cup,The Associated Press & Scripps National,"4:05 PM, May 30, 2022 "
https://www.kshb.com/news/national/trump-calls-decision-to-overturn-roe-a-win-for-life,Trump calls decision to overturn Roe a 'win for life',Scripps National,"12:39 PM, Jun 24, 2022 "
https://www.kshb.com/news/coronavirus/covid-survivor-shares-her-story-university-health-remembers-first-covid-patient-2-years-later,University Health recalls first COVID patient 2 years later,Leslie DelasBour,"10:27 PM, Mar 20, 2022 "
https://www.kshb.com/entertainment/tom-cruise-earns-biggest-opening-weekend-of-his-career-with-top-gun-maverick,Tom Cruise earns biggest opening weekend of his career with 'Top Gun: Maverick' ,Sarah Dewberry,"2:31 PM, May 30, 2022 "
https://www.kshb.com/news/local-news/average-property-evaluation-jumps-11-in-johnson-county-ks,"Average property evaluation jumps 11% in Johnson County, KS",Andres Gutierrez,"2:35 PM, Feb 28, 2022 "
https://www.kshb.com/news/national/n-korea-reports-6-deaths-after-admitting-covid-19-outbreak,N. Korea reports 6 deaths after admitting COVID-19 outbreak,The Associated Press & Scripps National,"10:49 AM, May 13, 2022 "
https://www.kshb.com/baby-giraffes-life-saved-custom-leg-braces,Baby Giraffe’s Life Saved Thanks To Custom Leg Braces,Kathleen St. John,"12:35 PM, May 16, 2022 "
https://www.kshb.com/news/crime/kckpd-investigating-homicide-in-1600-block-of-birch-street,KCKPD investigating homicide in 1600 block of Birch Street,Katelyn Brown,"5:55 AM, Feb 16, 2022 "
https://www.kshb.com/news/national/teachers-using-new-tool-to-help-students-understand-crisis-in-ukraine,Teachers helping students understand crisis in Ukraine,Scripps National,"1:15 PM, May 03, 2022 "
https://www.kshb.com/news/local-news/12-year-old-olathe-boy-dies-in-shawnee-county-ks-crash,"12-year-old Olathe boy dies in Shawnee County, KS crash",Casey Murray,"10:08 AM, Apr 04, 2022 "
https://www.kshb.com/sports/reports-chiefs-to-use-franchise-tag-on-ot-orlando-brown-jr,Chiefs place franchise tag on OT Orlando Brown Jr.,Katelyn Brown,"7:35 AM, Mar 07, 2022 "
https://www.kshb.com/sports/possible-chiefs-secondary-targets-in-free-agency-nick-jacobs,Possible Chiefs DB targets in free agency: Nick Jacobs,Nick Jacobs,"8:00 AM, Mar 02, 2022 "
https://www.kshb.com/banana-cake-cream-cheese-frosting,"Banana Cake With Cream Cheese Frosting Is Light, Creamy And Sweet",Kate Emswiler,"8:00 AM, May 07, 2022 "
https://www.kshb.com/pillsburys-flag-sugar-cookie-dough-supports-vets,Pillsbury’s New American Flag Sugar Cookie Dough Supports A Veteran Nonprofit,Kaitlin Gates,"6:30 AM, May 18, 2022 "
https://www.kshb.com/money/consumer/dont-waste-your-money/woman-loses-1-000-to-rental-scam-is-now-warning-others,"Woman loses $1,000 to rental scam, is now warning others",John Matarese,"4:57 AM, May 16, 2022 "
https://www.kshb.com/news/national/jp-morgan-analysts-predict-gas-will-surge-past-6-this-summer,JP Morgan analysts predict gas will surge past $6 ,WXYZ Staff,"8:25 AM, May 19, 2022 "
https://www.kshb.com/get-cordless-vacuum-219-right-now,This Cordless Vacuum Normally Sells For $679—But You Can Get It For $219 Right Now,Tricia Goss,"8:15 AM, May 10, 2022 "
https://www.kshb.com/news/crime/fugitive-from-north-carolina-murder-arrested-in-shawnee,Fugitive from North Carolina murder arrested in Shawnee,David Medina,"2:52 PM, Mar 01, 2022 "
https://www.kshb.com/news/national/man-charged-in-buffalo-massacre-due-back-in-court,Man charged in Buffalo massacre due back in court,The Associated Press & Scripps National,"6:40 AM, May 19, 2022 "
https://www.kshb.com/news/national/texas-court-spares-man-who-killed-girl-11-from-execution,"Texas court spares man who killed girl, 11, from execution",The Associated Press & Scripps National,"5:54 PM, May 25, 2022 "
https://www.kshb.com/news/local-news/monday-night-apartment-fire-in-independence-damages-building-melts-several-vehicles,"Apartment fire in Independence damages building, melts several vehicles",Sam Hartle,"2:48 PM, Jul 05, 2022 "
https://www.kshb.com/news/national/national-oceanic-and-atmospheric-administration-hawaii-hurricane-season-forecasted-to-be-slow-with-la-nina,Hawaii hurricane season forecasted to be slow with La Nina,The Associated Press & Scripps National,"7:50 PM, May 18, 2022 "
https://www.kshb.com/news/local-news/kansas-republicans-call-for-a-special-session-over-biden-administration-covid-19-mandates,Kansas Republicans call for a special session,Casey Murray,"5:11 PM, Nov 11, 2021 "
https://www.kshb.com/sports/report-eric-bieniemy-to-return-chiefs-in-2022,Report: Eric Bieniemy to return Chiefs as OC in 2022,Tod Palmer,"3:26 PM, Feb 24, 2022 "
https://www.kshb.com/news/local-news/overland-park-couple-serves-on-frontlines-of-ukrainian-border-crossings-in-romania,OP couple serves on frontlines of Ukrainian border crossings ,JuYeon Kim,"6:46 PM, Mar 13, 2022 "
https://www.kshb.com/clever-table-dining-pool-pingpong-settings,"This Clever Piece Of Furniture Is A Dining Table, Pool Table And Pingpong Table All In One",Clint Davis,"9:25 AM, May 09, 2022 "
https://www.kshb.com/news/national/no-more-streaming-only-debuts-for-oscar-awards-hopefuls-debuts-should-happen-in-theaters,No more streaming-only debuts for Oscar awards hopefuls,The Associated Press & Scripps National,"5:51 PM, May 18, 2022 "
https://www.kshb.com/news/coronavirus/wyandotte-county-ends-contact-tracing-residents-can-report-cases-online,UGPHD ends contact tracing; people can report cases online,Sam Hartle,"9:52 AM, Jan 24, 2022 "
https://www.kshb.com/news/local-news/raytown-police-searching-for-missing-teen-boy,Raytown police searching for missing teen boy,Addi Weakley,"4:44 PM, Mar 10, 2022 "
https://www.kshb.com/news/crime/father-pleads-guilty-in-murder-of-his-3-year-old-daughter,Father pleads guilty in murder of his 3-year-old daughter,Steve Kaut,"5:02 PM, Feb 18, 2022 "
https://www.kshb.com/news/national/bidens-approval-dips-to-lowest-of-presidency,Biden's approval dips to lowest of presidency,Scripps News Staff,"1:36 PM, May 20, 2022 "
https://www.kshb.com/news/national/congressional-budget-office-says-inflation-to-last-into-2023,Congressional Budget Office says inflation to last into 2023,The Associated Press & Scripps National,"2:10 PM, May 25, 2022 "
https://www.kshb.com/news/local-news/liberty-police-department-investigates-fatal-motorcycle-crash,Liberty police investigates fatal motorcycle crash,Katharine Finnerty,"11:29 AM, Mar 18, 2022 "
https://www.kshb.com/news/local-news/kansas-city-area-residents-officials-prepare-for-strong-winds-on-wednesday,"KC residents, officials prepare for strong winds on Wednesday ",Megan Abundis,"9:15 PM, Dec 14, 2021 "
https://www.kshb.com/news/local-news/smithville-police-request-assistance-locating-missing-man,Smithville police request assistance locating missing man,Jack Anstine,"7:05 AM, Mar 05, 2022 "
https://www.kshb.com/news/local-news/clinton-missouri-woman-dies-from-injuries-sustained-in-crash-on-i-435-near-bannister-road,Clinton woman dies from injuries sustained in February crash,David Medina,"5:00 PM, Mar 18, 2022 "
https://www.kshb.com/news/national/bahamas-calls-on-us-to-help-with-investigation-of-tourists-deaths,Bahamas calls on US to help with tourist death investigation,The Associated Press & Scripps National,"1:19 PM, May 10, 2022 "
