url,title,author,date
https://www.kshb.com/news/national/mastercard-program-uses-biometric-recognition-for-card-payments,Mastercard program uses biometric recognition for payments,Justin Boggs,"11:24 AM, May 19, 2022 "
https://www.kshb.com/free-formula-exchange-is-helping-parents-during-nationwide-shortage,Free Formula Exchange Is Helping Parents During Nationwide Shortage,Kathleen St. John,"3:35 PM, May 18, 2022 "
https://www.kshb.com/news/national/family-of-uvalde-shooting-victim-petitions-for-gun-law-change,Family of Uvalde shooting victim petitions for gun law change ,KXXV Staff,"9:34 PM, Jun 02, 2022 "
https://www.kshb.com/news/crime/more-than-50-cars-broken-into-in-overland-park-tuesday-night,Dozens of cars broken into in Overland Park Tuesday night,Katelyn Brown,"7:51 AM, Mar 23, 2022 "
https://www.kshb.com/news/local-news/fire-crews-called-to-bar-fire-off-n-brighton-avenue-wednesday-morning,Firefighters called to bar fire on N. Brighton Avenue,Gary Brauer,"7:57 AM, Mar 16, 2022 "
https://www.kshb.com/news/national/happy-is-an-asian-elephant-but-is-she-also-a-person,Happy is an Asian elephant. But is she also a person?,The Associated Press & Scripps National,"1:01 PM, May 20, 2022 "
https://www.kshb.com/news/local-news/road-conditions-still-hazardous-across-kansas-city,Road conditions still hazardous across Kansas City,Katelyn Brown,"5:45 AM, Feb 18, 2022 "
https://www.kshb.com/news/national/buffalo-supermarket-shooting-survivor-recalls-terrifying-incident,Buffalo supermarket shooting survivor recalls horror,WKBW Staff,"11:46 AM, May 16, 2022 "
https://www.kshb.com/entertainment/kc-spotlight/try-anu-aesthetics-today,Try aNu Aesthetics today!,KC Spotlight Staff,"4:11 PM, Jan 20, 2022 "
https://www.kshb.com/news/local-news/historic-restaurants-in-kansas-city-aim-to-keep-roots-of-soul-food-alive,Historic KC restaurants aim to keep soul food alive,JuYeon Kim,"8:28 PM, Feb 20, 2022 "
https://www.kshb.com/news/national/xfinity-customer-reports-500-000-charge-on-account-after-system-refresh,"Xfinity customer reports $500,000 charge on account ",KMGH Staff,"1:11 PM, May 18, 2022 "
https://www.kshb.com/news/national/sen-murphy-begs-for-gun-compromise-after-texas-shooting,Sen. Murphy begs for gun compromise after Texas shooting,The Associated Press & Scripps National,"5:50 PM, May 24, 2022 "
https://www.kshb.com/most-popular-sandals-women-amazon,10 Of The Most Popular Sandals For Women That You Can Buy On Amazon Right Now,Tricia Goss,"12:25 PM, May 11, 2022 "
https://www.kshb.com/entertainment/ellen-degeneres-ends-daytime-show-with-plea-for-compassion,Ellen DeGeneres ends daytime show with plea for compassion,The Associated Press & Scripps National,"1:43 PM, May 26, 2022 "
https://www.kshb.com/bridgerton-season-3-explore-colins-story,‘Bridgerton’ Season 3 Will Tell Colin Bridgerton And Penelope Featherington’s Love Story,Anna Weaver,"9:50 AM, May 17, 2022 "
https://www.kshb.com/weather/very-windy-today-chance-of-evening-t-storms-mainly-east-of-kc,Sunshine leads to showers Sunday,Wes Peery,"6:36 AM, Mar 05, 2022 "
https://www.kshb.com/news/national/vigilante-scratching-out-qr-codes-on-badly-parked-rental-scooters,Vigilante scratching out QR codes on badly parked scooters,KMGH Staff,"8:03 PM, May 23, 2022 "
https://www.kshb.com/used-electric-cars-tips-buying-negotiating,Used Electric Cars Are In Demand—Here’s What To Know To Buy At An Affordable Price,Tricia Goss,"6:30 AM, May 19, 2022 "
https://www.kshb.com/news/local-news/tractor-trailer-crash-on-tuesday-shuts-down-interstate-70-in-leavenworth-county,Tractor trailer crash closes I-70 in Leavenworth County ,Steve Kaut,"10:14 PM, Mar 01, 2022 "
https://www.kshb.com/news/local-news/fire-destroys-detached-garage-in-gardner-kansas,"Fire destroys detached garage in Gardner, Kansas",Steve Kaut,"5:01 PM, Jan 13, 2022 "
https://www.kshb.com/news/local-news/it-was-terrifying-residents-in-st-joseph-react-to-tornado-aftermath,Residents in St. Joseph react to tornado aftermath,JuYeon Kim,"6:05 PM, Mar 30, 2022 "
https://www.kshb.com/news/national-politics/supreme-court-looks-at-expanding-second-amendment-rights,SCOTUS looks at expanding Second Amendment rights,Scripps National,"11:20 AM, May 26, 2022 "
https://www.kshb.com/news/national/5-people-killed-after-two-boats-collide-on-georgia-river,5 people killed after two boats collide on Georgia river,Sarah Dewberry,"1:47 PM, May 30, 2022 "
https://www.kshb.com/news/national/two-nypd-officers-honored-for-saving-visually-impaired-man-from-subway-tracks,NYPD officers save visually impaired man from subway tracks,Sarah Dewberry,"11:00 AM, May 26, 2022 "
https://www.kshb.com/news/national/nonprofits-step-up-to-help-single-parents-serving-in-u-s-military,Nonprofits step up to help single parents serving in U.S. military,Maya Rodriguez,"7:49 AM, May 26, 2022 "
https://www.kshb.com/news/local-news/kc-teacher-pays-tribute-to-the-history-of-jazz-black-artists-through-community-art-project,KC teacher pays tribute to the history of jazz,JuYeon Kim,"5:01 PM, Feb 25, 2022 "
https://www.kshb.com/news/national/scripps-howard-foundation-announces-finalists-for-69th-scripps-howard-awards, Finalists for 69th Scripps Howard Awards announced,Scripps National,"11:04 AM, May 19, 2022 "
https://www.kshb.com/news/local-news/voters-elect-rory-rowland-as-next-independence-mayor,Independence voters elect Rory Rowland as mayor,David Medina,"9:27 PM, Apr 05, 2022 "
https://www.kshb.com/news/local-news/video-thousands-of-fans-brave-winter-storm-to-attend-big-12-tournament,VIDEO: Fans brave winter storm to attend Big 12 Tournament ,JuYeon Kim,"5:29 PM, Mar 10, 2022 "
https://www.kshb.com/news/local-news/olathe-couple-raising-funds-for-refugee-efforts-in-europe,Olathe couple raising funds for refugee efforts in Europe,Dan Cohen,"8:54 PM, Mar 09, 2022 "
https://www.kshb.com/news/national/two-americas/affordable-housing-has-positive-effect-on-home-values,Affordable housing has positive effect on home values,Diane Duenez,"10:28 AM, May 26, 2022 "
https://www.kshb.com/news/national/denver-bans-concealed-carry-of-guns-at-parks-city-buildings,"Denver City Council bans concealed carry guns from parks, city buildings",Robert Garrison,"1:16 PM, May 17, 2022 "
https://www.kshb.com/news/national/mental-health-less-a-priority-for-employers-these-days-experts-say,"Mental health less a priority for employers these days, experts say",Scripps National,"1:40 PM, Jun 02, 2022 "
https://www.kshb.com/news/local-news/resources-to-offer-support-to-ukraine,Resources to offer support to Ukraine ,Addi Weakley,"8:15 PM, Feb 25, 2022 "
https://www.kshb.com/news/national/intersection-to-honor-george-floyd-renamed-in-minneapolis,Intersection to honor George Floyd renamed in Minneapolis,The Associated Press & Scripps National,"8:01 AM, May 26, 2022 "
https://www.kshb.com/sports/college-sports/ku/kansas-basketball-signs-top-5-recruiting-class-during-ncaas-early-period,KU hoops signs top-5 recruiting class during early period,Tod Palmer,"12:53 PM, Nov 11, 2021 "
https://www.kshb.com/sports/kansas-city-chiefs-host-10th-annual-style-lounge,Kansas City Chiefs host 10th Annual Style Lounge,Hayley Lewis,"10:03 PM, Oct 19, 2021 "
https://www.kshb.com/news/national/north-korea-reports-270-000-new-fever-cases-amid-covid-19-crisis,"N. Korea reports 270,000 new fever cases amid COVID crisis",The Associated Press & Scripps National,"7:01 PM, May 16, 2022 "
https://www.kshb.com/news/crime/another-missouri-man-charged-in-jan-6-riot-at-the-u-s-capitol,Missouri man charged in Jan. 6 riot at the U.S. Capitol,Casey Murray,"9:58 AM, Mar 14, 2022 "
https://www.kshb.com/baby-formula-shortage-dont-do-dangerous-things,3 Dangerous Things Parents Shouldn’t Do If They Can’t Find Baby Formula,Marie Rossiter,"1:25 PM, May 19, 2022 "
https://www.kshb.com/news/national/abbott-plant-could-produce-formula-in-1-2-weeks-fda-head-said,Abbott plant could produce formula in 1-2 weeks,Justin Boggs,"11:43 AM, May 19, 2022 "
https://www.kshb.com/news/national/who-works-the-most-on-national-leave-the-office-early-day,"Who works the most on National Leave the Office Early Day?
",Justin Boggs,"10:12 AM, Jun 02, 2022 "
https://www.kshb.com/news/local-news/kc-streetcar-to-reveal-designs-for-possible-northbound-extensions-tuesday,KC Streetcar to reveal possible north extension designs,Charlie Keegan,"7:02 AM, Jun 28, 2022 "
https://www.kshb.com/news/national/senate-minority-leader-mcconnell-says-he-wont-support-ketanji-brown-jackson-for-high-court,McConnell to oppose Ketanji Brown Jackson for high court,Scripps National,"3:40 PM, Mar 24, 2022 "
https://www.kshb.com/news/olathe-east-shooting/history-of-school-resource-officers,History of school resource officers ,Jessica McMaster,"6:00 PM, Mar 09, 2022 "
https://www.kshb.com/news/local-news/independence-police-want-to-amend-prop-p-to-pay-for-more-than-new-officers,IPD wants to amend Prop P to pay for more than new officers,Tod Palmer,"1:28 PM, Oct 27, 2021 "
https://www.kshb.com/news/national/pennsylvania-north-carolina-test-trump-clout-in-2022-elections,"Election 2022: Pennsylvania, North Carolina test Trump clout",The Associated Press & Scripps National,"6:57 PM, May 17, 2022 "
https://www.kshb.com/news/national/biden-leaders-navigating-dark-hour-after-ukraine-invasion,Biden: Leaders navigating 'dark hour' after Ukraine invasion,Scripps National,"6:29 AM, May 24, 2022 "
https://www.kshb.com/news/spelling-bee/speller-reinstated-into-scripps-national-spelling-bee-after-appeal,Speller reinstated into National Spelling Bee after appeal,The Associated Press & Scripps National,"8:35 AM, Jun 02, 2022 "
https://www.kshb.com/news/black-history-month/attitude-of-determination-isaac-franklin-bradley-sr-became-first-black-ku-law-grad-kck-judge,"Legacy of first Black KU Law graduate, KCK judge",Megan Abundis,"4:00 PM, Mar 01, 2022 "
https://www.kshb.com/news/national/the-push-to-make-more-beaches-open-to-the-public,The push to make more beaches open to the public,Chris Conte,"1:11 PM, May 30, 2022 "
https://www.kshb.com/news/national/fudgementals-recalls-products-containing-jif-peanut-butter,Fudgementals recalls products containing Jif peanut butter,Sarah Dewberry,"5:24 PM, May 26, 2022 "
https://www.kshb.com/news/national/russia-ukraine-conflict/mcdonalds-finds-a-buyer-for-russian-restaurants,McDonald's finds a buyer for Russian restaurants,The Associated Press & Scripps National,"8:38 AM, May 19, 2022 "
https://www.kshb.com/why-inclined-baby-sleepers-are-so-dangerous,Why Inclined Baby Sleepers Are So Dangerous,Tricia Goss,"8:30 AM, May 19, 2022 "
https://www.kshb.com/news/national/after-buffalo-massacre-ny-governor-seeks-action-on-guns,"After Buffalo massacre, NY governor seeks action on guns",The Associated Press & Scripps National,"2:58 PM, May 18, 2022 "
https://www.kshb.com/news/local-news/waste-management-suspends-trash-collection-across-kansas-city-on-feb-2,Waste Management suspends trash collection on Feb. 2,Sam Hartle,"2:57 PM, Feb 01, 2022 "
https://www.kshb.com/news/local-news/missouri-house-oks-elections-for-transgender-athletic-bans,Missouri House OKs elections for transgender athletic bans,Associated Press,"10:15 PM, Apr 13, 2022 "
https://www.kshb.com/news/local-news/eastwood-hills-residents-hear-about-proposed-pallet-shelter-location,Eastwood Hills residents weigh in on proposed pallet shelter ,Andres Gutierrez,"9:15 PM, Mar 15, 2022 "
https://www.kshb.com/news/crime/man-dead-in-early-morning-kansas-city-missouri-shooting,"Man dead in early morning Kansas City, Missouri, shooting ",Jack Anstine,"7:22 AM, Feb 05, 2022 "
https://www.kshb.com/news/national/official-details-how-gunman-entered-texas-classroom-killing-19-students-2-teachers,Officials explain how gunman entered Texas classroom,Justin Boggs,"7:47 AM, May 25, 2022 "
https://www.kshb.com/news/national/megan-markle-visits-memorial-for-21-killed-in-texas-shooting,Meghan Markle visits memorial for 21 killed in Texas shooting,Scripps National,"3:18 PM, May 26, 2022 "
https://www.kshb.com/news/local-news/kansas-missouri-governors-announce-initiative-to-improve-national-security,"MO, KS governors announce initiative to improve national security ",David Medina,"2:51 PM, Sep 21, 2021 "
https://www.kshb.com/news/national/broken-comet-could-leave-behind-impressive-meteor-shower,Broken comet could leave behind impressive meteor shower,Justin Boggs,"9:42 AM, May 30, 2022 "
https://www.kshb.com/news/national-politics/country-continues-to-wait-for-student-debt-forgiveness-decision-by-president-biden,US continues to wait for student debt forgiveness decision from Biden,Joe St. George,"4:00 AM, Jun 02, 2022 "
https://www.kshb.com/news/local-news/kansas-shoppers-say-state-food-tax-cut-could-benefit-families,KS shoppers say state food tax cut could benefit families,Megan Abundis,"9:05 PM, Nov 08, 2021 "
https://www.kshb.com/news/national/embryo-adoption-is-more-cost-effective-ivf-treatment,Embryo adoption is more cost-effective IVF treatment,Michelle London,"10:06 AM, May 16, 2022 "
https://www.kshb.com/news/local-news/purple-peace-foundation-opens-new-facility-after-10-years,Purple Peace Foundation opens new facility after 10 years ,Leslie DelasBour,"10:44 PM, Mar 26, 2022 "
https://www.kshb.com/news/national/suspect-charged-in-deadly-california-church-shooting,Suspect charged in deadly California church shooting,The Associated Press & Scripps National,"1:20 PM, May 17, 2022 "
https://www.kshb.com/news/national/walmart-apologizes-for-juneteenth-product-amid-backlash,Walmart apologizes for Juneteenth product amid backlash,Sarah Dewberry,"12:35 PM, May 26, 2022 "
https://www.kshb.com/news/national/actor-fred-ward-dies-at-the-age-of-79-publicist-says,Actor Fred Ward dies at the age of 79,Scripps National,"12:23 PM, May 13, 2022 "
https://www.kshb.com/sports/chiefs-reportedly-will-reunite-with-c-austin-reiter,Chiefs reportedly will reunite with C Austin Reiter,Tod Palmer,"11:22 AM, Mar 23, 2022 "
https://www.kshb.com/weather/weather-blog-tracking-two-to-three-severe-weather-chances,Weather Blog: Tracking 2-3 severe weather chances,Jeff Penner,"8:27 AM, Apr 10, 2022 "
https://www.kshb.com/news/national/special-olympics-drops-vaccine-mandate-after-facing-27m-fine,Special Olympics ends vaccine mandate after facing $27M fine,The Associated Press & Scripps National,"12:57 PM, Jun 03, 2022 "
https://www.kshb.com/news/national/cdc-issues-travel-alert-amid-spread-of-monkeypox,CDC issues travel alert amid spread of monkeypox,Justin Boggs,"11:06 AM, May 26, 2022 "
https://www.kshb.com/news/national/ghost-guns-used-in-recent-school-shootings-experts-call-for-action,Ghost guns used in recent school shootings,Scripps National,"3:29 PM, Mar 24, 2022 "
https://www.kshb.com/news/national/california-woman-finds-36-000-in-couch-she-got-for-free-off-craigslist,"Woman finds $36,000 in couch she got for free off Craigslist",Scripps National,"11:52 AM, Jun 03, 2022 "
https://www.kshb.com/news/national/climate-change-threatens-saguaro-cactis-survival,Climate change threatens saguaro cacti,Scripps News Staff,"10:11 PM, May 19, 2022 "
https://www.kshb.com/news/coronavirus/hospital-leaders-community-members-reflect-on-2nd-anniversary-of-covid-19-pandemic,"Community members, hospitals reflect on 2 years of COVID-19",Emma James,"4:49 PM, Mar 11, 2022 "
https://www.kshb.com/weather/weather-blog-the-first-four-days-of-spring-fire-water-ice,"Weather Blog: First 4 days of spring, ""fire, water & ice""",Jeff Penner,"8:10 AM, Mar 20, 2022 "
https://www.kshb.com/news/national/starbucks-leaving-russian-market-shutting-130-stores,"Starbucks leaving Russian market, shutting 130 stores",The Associated Press & Scripps National,"11:13 AM, May 23, 2022 "
https://www.kshb.com/news/national/ukraines-leader-remains-defiant-on-victory-over-russia,Ukraine leader defiant on victory over Russia,The Associated Press & Scripps National,"8:28 PM, May 27, 2022 "
https://www.kshb.com/news/coronavirus/kcmo-mayor-quinton-lucas-says-he-will-not-renew-school-mask-mandate,KCMO Mayor Lucas says he will not renew mask mandate,Casey Murray,"2:43 PM, Feb 15, 2022 "
https://www.kshb.com/news/national/bills-to-soon-sell-choose-love-shirts-to-benefit-shooting-victims,Bills to soon sell 'Choose Love' shirts to benefit shooting victims,WKBW Staff,"1:28 PM, May 20, 2022 "
https://www.kshb.com/news/national/bidens-to-host-2020-2022-us-olympic-teams-at-white-house-to-celebrate-athletes,"Bidens to host 2020, 2022 US Olympic Teams at White House",The Associated Press & Scripps National,"7:55 PM, May 02, 2022 "
https://www.kshb.com/news/national/fbi-director-details-to-senate-committee-threat-lone-actors-pose-in-wake-of-texas-shooting,FBI director details to Senate committee threat lone actors pose in wake of Texas shooting,Scripps National,"4:49 PM, May 25, 2022 "
https://www.kshb.com/news/national/ringling-bros-announces-comeback-tour-but-without-animals,Ringling Bros. announces comeback tour but without animals,The Associated Press & Scripps National,"10:29 AM, May 18, 2022 "
https://www.kshb.com/news/national/formula-shortage-impacting-those-with-rare-metabolic-diseases,Formula shortage impacting those with metabolic diseases,KIVI Staff,"11:32 AM, May 24, 2022 "
https://www.kshb.com/weather/more-sunshine-and-warm-weather-today,Wonderful Wednesday then storm system in the KC area,Jeff Penner,"3:46 AM, Mar 15, 2022 "
https://www.kshb.com/news/local-news/severe-storms-damage-st-joseph-homes,NWS confirms EF-1 tornado struck St. Joseph,Jamie Peters,"5:33 AM, Mar 30, 2022 "
https://www.kshb.com/news/local-news/filmmakers-of-new-documentary-hold-your-fire-sit-down-with-kshb-41-news,New documentary 'Hold Your Fire' focuses on police reform,Charlie Keegan,"2:46 PM, Mar 30, 2022 "
https://www.kshb.com/news/local-news/hip-hop-legends-snoop-dogg-ice-cube-to-perform-at-azura-amphitheater,"Snoop Dogg, Ice Cube to perform at Azura Amphitheater",David Medina,"5:09 PM, Feb 25, 2022 "
https://www.kshb.com/amazon-memorial-day-deals-best-this-year,Amazon’s Memorial Day deals are here—including $74 off Apple AirPods,Kaitlin Gates,"1:00 PM, May 13, 2022 "
https://www.kshb.com/sports/autopsy-shows-steelers-qb-haskins-was-drunk-when-fatally-struck,Autopsy shows Steelers QB Haskins was drunk when fatally struck,Sarah Dewberry,"5:01 PM, May 23, 2022 "
https://www.kshb.com/news/local-news/winter-weather-advisory-issued-for-kansas-city-area-wednesday,Winter weather advisory issued for Kansas City area,Casey Murray,"3:45 PM, Jan 05, 2022 "
https://www.kshb.com/news/national/doj-declines-to-charge-former-fbi-agents-in-botched-larry-nassar-probe,DOJ declines to charge former FBI agents in botched Larry Nassar probe,Sarah Dewberry,"3:29 PM, May 27, 2022 "
https://www.kshb.com/news/local-news/investigations/price-tracker/tracking-prices-items-most-affected-in-kc-metro,Tracking prices: Items most affected in KC metro,Caitlin Knute,"6:21 PM, Mar 02, 2022 "
https://www.kshb.com/news/national/staff-at-more-starbucks-stores-in-new-york-vote-on-union,More Starbucks staff vote on union,Douglas Jones,"3:45 PM, Jan 14, 2022 "
https://www.kshb.com/news/national/911-dispatcher-accused-of-hanging-up-call-during-buffalo-supermarket-shooting,911 dispatcher on leave after Buffalo shooting,The Associated Press & Scripps National,"9:58 AM, May 19, 2022 "
https://www.kshb.com/news/national/former-president-trump-other-republicans-plan-to-speak-at-nra-convention-in-texas,Former President Trump plans to speak at NRA convention,Scripps National,"12:28 PM, May 25, 2022 "
https://www.kshb.com/news/crime/3-ex-sedgwick-county-jail-deputies-charged-in-steroids-case,3 ex-Sedgwick County jail deputies charged in steroids case,Associated Press,"11:00 AM, Mar 17, 2022 "
https://www.kshb.com/news/local-news/kc-federal-grand-jury-indicts-pharmacist-for-tampering-with-consumer-product,KC federal grand jury indicts pharmacist for tampering,Katharine Finnerty,"10:39 AM, Feb 16, 2022 "
https://www.kshb.com/news/local-news/kc-current-to-flip-evergy-plaza-lighting-ceremony-switch,KC Current to flip switch at Evergy Plaza Lighting Ceremony ,Addi Weakley,"6:28 PM, Nov 11, 2021 "
https://www.kshb.com/news/local-news/suv-hits-kansas-city-kansas-home-damaging-porch,"SUV hits Kansas City, Kansas home, damaging porch",Jamie Peters,"1:59 AM, Jun 07, 2022 "
https://www.kshb.com/news/national/amid-shortages-fda-allows-abbott-to-release-baby-formula-from-facility-after-recall,"FDA allows Abbott to release baby formula from facility
",Justin Boggs,"1:05 PM, May 11, 2022 "
https://www.kshb.com/news/local-news/buck-oneil-bridge-southbound-northbound-lanes-closed-due-to-injury-crash,"Buck O'Neil Bridge NB, SB lanes reopened after injury crash ",David Medina,"8:00 PM, Mar 18, 2022 "
https://www.kshb.com/pineapple-casserole-recipe-is-cheesy-sweet-side,"This Pineapple Casserole Recipe Makes A Cheesy, Sweet Side Dish",Kathleen St. John,"6:30 AM, May 25, 2022 "
https://www.kshb.com/weather/weather-blog-some-snow-is-possible-by-thursday-morning,Weather Blog - Some snow is possible by Thursday morning,Gary Lezak,"7:41 AM, Mar 30, 2022 "
https://www.kshb.com/news/local-news/kansas-city-approves-funding-for-housing-navigation-center-to-help-people-get-permanent-housing,Lotus Care House to open Housing Navigation Center for homeless,Sarah Plake,"4:51 PM, Dec 13, 2021 "
https://www.kshb.com/news/local-news/silver-alert-issued-for-missing-wichita-man,"Silver Alert canceled, Wichita man located",Addi Weakley,"3:28 PM, Mar 19, 2022 "
https://www.kshb.com/news/national/prevention-program-focuses-on-those-most-likely-to-be-involved-in-gun-violence,Anti-violence program sees promising results,Ash-har Quraishi,"8:47 AM, May 20, 2022 "
https://www.kshb.com/news/national/two-americas/mental-health-services-now-being-offered-in-more-schools,Mental health services now being offered in more schools,Diane Duenez,"10:11 AM, May 19, 2022 "
https://www.kshb.com/news/crime/weapon-confiscated-at-center-high-school-tuesday-morning,Weapon confiscated at Center High School Tuesday morning ,Casey Murray,"10:05 AM, Mar 16, 2022 "
https://www.kshb.com/news/national/united-airlines-to-transport-infant-formula-from-england-to-us-free-of-charge,United Airlines to transport infant formula from England,The Associated Press & Scripps National,"11:56 AM, Jun 01, 2022 "
https://www.kshb.com/news/local-news/california-man-charged-after-disturbance-on-american-airlines-flight-diverted-to-kansas-city,Man charged after disturbance on flight diverts plane to KCI,Jack Anstine,"3:36 PM, Feb 14, 2022 "
https://www.kshb.com/news/national/boeing-capsule-lands-back-on-earth-after-space-shakedown-repeated-test-flight,Boeing capsule lands back on Earth after space shakedown,The Associated Press & Scripps National,"9:06 PM, May 25, 2022 "
https://www.kshb.com/new-york-city-removes-last-public-pay-phone,New York Has Removed Its Last Public Pay Phone,Tricia Goss,"1:25 PM, May 24, 2022 "
https://www.kshb.com/news/national/who-monkeypox-likely-spread-by-sex-at-raves-in-europe,Monkeypox likely spread by sex at raves in Europe,The Associated Press & Scripps National,"8:49 AM, May 23, 2022 "
https://www.kshb.com/news/local-news/ray-county-sheriffs-office-seeking-publics-help-to-locate-missing-teen,Ray County Sheriff’s Office seeks help locating missing teen ,Addi Weakley,"3:55 PM, Mar 18, 2022 "
https://www.kshb.com/news/local-news/kansas-city-police-looking-for-missing-34-year-old-woman,KCMO police locate missing 34-year-old woman,Jamie Peters,"4:26 AM, Feb 07, 2022 "
https://www.kshb.com/sams-club-sampling-event-new-products,Sam’s Club is holding a huge sampling event so you can taste lots of new products at once,Kaitlin Gates,"5:30 AM, May 18, 2022 "
https://www.kshb.com/news/national/day-after-texas-mass-school-shooting-names-of-victims-being-released,Gov. Abbott: Texas gunman warned online he was going to shoot up school,Justin Boggs,"6:27 AM, May 25, 2022 "
https://www.kshb.com/marcus-ericsson-wins-the-106th-indy-500,Marcus Ericsson wins the 106th Indy 500 ,WRTV Staff,"3:02 PM, May 29, 2022 "
https://www.kshb.com/news/national/puerto-rico-firefighter-accused-in-illegal-migration-case,Puerto Rico firefighter accused in illegal migration case,The Associated Press & Scripps National,"6:32 AM, May 20, 2022 "
https://www.kshb.com/news/local-news/a-guide-to-tracking-road-conditions-across-the-kansas-city-area,GUIDE | Tracking road conditions across Kansas City area,Jack Anstine,"5:27 PM, Feb 01, 2022 "
https://www.kshb.com/sports/local-sports/high-school/ku-signee-gradey-dick-wins-gatorade-national-boys-basketball-player-of-the-year,KU signee Dick wins Gatorade national basketball POY honor,Megan Strickland,"4:00 PM, Mar 22, 2022 "
https://www.kshb.com/news/local-news/kc-artist-from-ukraine-fundraising-to-support-ukrainian-troops,KC artist from Ukraine fundraising to support her homeland,Andres Gutierrez,"6:33 PM, Mar 11, 2022 "
https://www.kshb.com/news/local-news/its-devastating-families-affected-by-covid-19-reflect-on-the-last-2-years,Families affected by COVID-19 reflect on the last 2 years,JuYeon Kim,"5:45 PM, Mar 11, 2022 "
https://www.kshb.com/news/local-news/fire-destroys-missouri-probation-and-parole-office,Fire destroys Missouri Probation and Parole office,Associated Press,"10:31 AM, Mar 10, 2022 "
https://www.kshb.com/news/national/police-3-shot-at-xavier-university-in-new-orleans,"1 dead, 2 wounded in shooting at Xavier University ",The Associated Press & Scripps National,"1:20 PM, May 31, 2022 "
https://www.kshb.com/news/national/undocumented-ukrainians-in-uk-face-possible-deportation-to-rwanda,Undocumented Ukrainians in UK face possible deportation to Rwanda,Scripps News Staff,"8:11 PM, May 23, 2022 "
https://www.kshb.com/news/national/russia-ukraine-conflict/eu-leaders-agree-on-partial-embargo-on-russian-oil,EU leaders agree on partial embargo on Russian oil,The Associated Press & Scripps National,"6:48 PM, May 30, 2022 "
