url,title,author,date
https://www.kshb.com/news/national/kevin-spacey-to-voluntarily-appear-in-uk-court-to-face-sex-assault-charges,Kevin Spacey to appear in UK court to face sex assault charges,Scripps National,"10:46 AM, May 31, 2022 "
https://www.kshb.com/sports/college-sports/ksu/bruce-weber-wildcats-have-to-be-in-attack-mode-vs-west-virginia,Weber: Wildcats 'have to be in attack mode' vs. West Virginia ,Megan Strickland,"12:59 PM, Mar 08, 2022 "
https://www.kshb.com/news/national/dad-learned-about-daughters-death-while-treating-classmate-at-scene-in-texas,Dad learned about daughter's death while treating classmate,CNN Newsource,"9:10 AM, May 26, 2022 "
https://www.kshb.com/news/local-news/jackson-county-legislature-approves-purchase-of-9m-building-for-county-administrative-offices,JaxCo Legislature approves purchase of $9M building,Katharine Finnerty,"12:28 PM, Apr 05, 2022 "
https://www.kshb.com/news/world/canada-likely-to-ban-handgun-sales-possession-of-assault-weapons,Canada likely to ban handgun sales,The Associated Press & Scripps National,"9:19 AM, May 31, 2022 "
https://www.kshb.com/news/local-news/charges-refiled-in-missouri-boat-sinking-that-killed-17,Charges refiled in Missouri boat sinking that killed 17,Associated Press,"4:50 PM, Apr 13, 2022 "
https://www.kshb.com/news/local-news/liberty-teen-discovers-tumor-size-of-small-cantaloupe-after-nudge-from-coaches,Liberty teen discovers tumor after nudge from coaches ,Lindsay Shively,"6:15 AM, Apr 14, 2022 "
https://www.kshb.com/news/national/mexican-megachurch-leader-pleads-guilty-in-los-angeles-to-sex-abuse,Mexican megachurch leader pleads guilty in LA to sex abuse,The Associated Press & Scripps National,"7:01 PM, Jun 03, 2022 "
https://www.kshb.com/news/crime/burglary-reported-at-independence-office-of-missouri-u-s-senate-candidate,Burglary reported at office of MO U.S. Senate candidate,Steve Kaut,"5:51 PM, Mar 30, 2022 "
https://www.kshb.com/news/national/elementary-school-students-help-turtle-zoom-around-again-with-3d-printed-wheels,Students give turtle 3D-printed wheels,KMTV Staff,"12:50 PM, May 20, 2022 "
https://www.kshb.com/news/local-news/proposed-kci-traffic-control-markers-pay-tribute-to-kansas-city-celebrities-barbecue,"Proposed KCI traffic control markers honor KC celebs, BBQ",David Medina,"10:05 PM, Jan 20, 2022 "
https://www.kshb.com/news/national/sources-kourtney-kardashian-and-travis-barker-now-legally-married,"Sources: Kourtney Kardashian, Travis Barker legally married",Scripps National,"11:52 AM, May 16, 2022 "
https://www.kshb.com/news/national/how-shootings-have-changed-schools,How shootings have changed schools,Scripps News Staff,"3:04 PM, May 30, 2022 "
https://www.kshb.com/news/local-news/overland-park-woman-plans-garage-bake-sale-to-support-ukraine,"Overland Park woman plans garage, bake sale to support Ukraine",Emma James,"6:32 PM, Mar 16, 2022 "
https://www.kshb.com/news/national/man-killed-in-suspected-gator-attack-in-florida,Man killed in suspected gator attack in Florida,WFTS Staff,"2:51 PM, May 31, 2022 "
https://www.kshb.com/news/local-news/community-gathers-to-remember-young-lives-lost-to-violence-in-kc,Community gathers to remember young lives lost to violence ,Leslie DelasBour,"10:54 PM, Feb 26, 2022 "
https://www.kshb.com/news/crime/family-awarded-over-20-million-in-malpractice-lawsuit-against-university-health-doctor,Family awarded over $20M in medical malpractice lawsuit ,Casey Murray,"2:47 PM, Apr 07, 2022 "
https://www.kshb.com/sports/college-sports/ku/jayhawks-eliminate-blue-jays-advance-to-sweet-16,"Jayhawks eliminate Blue Jays, advance to Sweet 16",Addi Weakley,"4:42 PM, Mar 19, 2022 "
https://www.kshb.com/sports/browns-qb-watson-facing-lawsuit-from-23rd-massage-therapist,Browns QB Watson facing lawsuit from 23rd massage therapist,The Associated Press & Scripps National,"3:34 PM, Jun 01, 2022 "
https://www.kshb.com/news/national/uvalde-hospital-says-all-school-shooting-patients-have-been-discharged-or-transferred,"Hospital: Shooting patients have been discharged, transferred ",Scripps National,"4:38 PM, May 25, 2022 "
https://www.kshb.com/news/local-news/blunt-joins-sens-hawley-marshall-moran-against-scotus-pick,"Blunt joins Sens. Hawley, Marshall, Moran against SCOTUS",Sam Hartle,"9:27 AM, Apr 04, 2022 "
https://www.kshb.com/news/crime/former-rockstar-burgers-owner-now-charged-with-rape-assault,"Former Rockstar Burgers owner now charged with rape, assault",Tod Palmer,"10:19 AM, Mar 17, 2022 "
https://www.kshb.com/news/crime/kcpd-help-needed-to-identify-suspect-in-robbery-attempt,KCPD: Help needed to identify suspect in robbery attempt,Katelyn Brown,"6:04 AM, Mar 08, 2022 "
https://www.kshb.com/news/crime/kansas-city-police-investigating-homicide-near-linwood-and-agnes,"2 adults killed, 5-year- old injured in overnight shooting",Jamie Peters,"1:44 AM, Feb 21, 2022 "
https://www.kshb.com/news/national/woman-injured-in-brooklyn-subway-shooting-sues-gun-maker-glock,Woman injured in Brooklyn subway shooting sues gun maker Glock,Sarah Dewberry,"1:09 PM, Jun 01, 2022 "
https://www.kshb.com/cosby-faces-sex-abuse-allegations-again-as-civil-trial-opens,Bill Cosby faces sex abuse allegations again,Scripps News Staff,"12:53 PM, Jun 01, 2022 "
https://www.kshb.com/weather/warmer-weather-into-the-weekend,The best chance of rain arrives Sunday night,Gary Lezak,"4:32 AM, Mar 04, 2022 "
https://www.kshb.com/news/local-news/ku-basketball-player-jalen-coleman-lands-gives-back-to-the-community,KU basketball player Lands gives back to the community,Jordan Betts,"8:57 AM, Mar 11, 2022 "
https://www.kshb.com/news/local-news/kansas-city-police-search-for-missing-daughter-and-father,Kansas City police find missing girl,David Medina,"1:02 PM, Sep 26, 2021 "
https://www.kshb.com/news/national/fda-allows-more-international-formula-to-enter-us-market,FDA allows more international formula to enter US market,Justin Boggs,"12:11 PM, Jun 03, 2022 "
https://www.kshb.com/news/local-news/made-for-kansas-city-bbq-championship-grand-champion-to-score-1-year-contract-in-new-kci-terminal,Made for KC BBQ Championship winner to score KCI contract,Addi Weakley,"10:31 AM, Feb 09, 2022 "
https://www.kshb.com/news/crime/ex-jackson-county-jail-officer-sentenced-for-taking-bribes,Ex-Jackson County jail officer sentenced for taking bribes,Associated Press,"2:46 PM, Apr 12, 2022 "
https://www.kshb.com/news/national/russia-ukraine-conflict/leader-in-russian-backed-chechnya-warns-poland-could-be-next-ukraine,Leader in Russian-backed Chechnya tells Poland it could be next,The Associated Press & Scripps National,"3:44 PM, May 27, 2022 "
https://www.kshb.com/news/national/if-you-froze-these-strawberries-youll-need-to-throw-them-away,Strawberries possibly linked to Hep A outbreak,Tatiana Salazar,"8:57 AM, May 30, 2022 "
https://www.kshb.com/news/national/idaho-state-assistant-football-coach-charged-with-murder,Idaho State assistant football coach charged with murder,The Associated Press & Scripps National,"11:09 AM, Jun 03, 2022 "
https://www.kshb.com/news/crime/blue-springs-contractor-charged-for-alleged-fraud-exploitation-of-elderly,"Blue Springs contractor charged for fraud, exploitation",Casey Murray,"12:03 PM, Mar 24, 2022 "
https://www.kshb.com/news/national/supreme-court-wont-speed-challenge-to-texas-abortion-limits,Supreme Court won't speed challenge to Texas abortion limits,The Associated Press & Scripps National,"4:02 PM, Jan 20, 2022 "
https://www.kshb.com/news/national/march-for-life-nations-largest-abortion-protest-faces-uncertain-future,March for Life returns to Washington,The Associated Press & Scripps National,"8:41 AM, Jan 21, 2022 "
https://www.kshb.com/news/national-politics/democrats-republicans-take-key-step-in-passing-massive-science-and-technology-bill,"Democrats, Republicans take key step in passing tech bill",Joe St. George,"2:16 PM, May 13, 2022 "
https://www.kshb.com/news/national/research-team-finds-late-presenting-symptoms-in-long-covid-patients,New research reveals long COVID can linger for years,Ashley Glass,"4:00 AM, May 27, 2022 "
https://www.kshb.com/stain-removal-pads-work-pressing-rug-foot,Stain Removal Pads Work By Just Pressing Them Into The Rug With Your Foot,Tricia Goss,"10:05 AM, May 17, 2022 "
https://www.kshb.com/news/local-news/kansas-city-homeless-agency-struggles-with-increasing-prices-supply-chain-issues,"Homeless agency struggles with higher prices, supply chain",Sam Hartle,"11:54 AM, Nov 11, 2021 "
https://www.kshb.com/news/national/u-s-museums-band-together-to-help-ukrainians-protect-cultural-artifacts,Museums band together to protect Ukrainian artifacts,Maya Rodriguez,"10:20 AM, May 19, 2022 "
https://www.kshb.com/news/national/judge-rules-oklahoma-can-continue-lethal-injections,Judge rules Oklahoma can continue lethal injections,KJRH Staff,"11:28 AM, Jun 06, 2022 "
https://www.kshb.com/entertainment/jurors-in-depp-defamation-trial-to-hear-closing-arguments-friday,Jurors in Depp defamation trial to hear closing arguments Friday,Scripps National,"3:30 PM, May 26, 2022 "
https://www.kshb.com/sports/tyreek-hills-top-moments-in-kansas-city,Former Chiefs WR Tyreek Hill's top moments in Kansas City ,Addi Weakley,"2:35 PM, Mar 23, 2022 "
https://www.kshb.com/sports/college-sports/ku/kansas-missouri-fans-excited-for-border-war-renewal-as-basketball-rivalry-resumes,"Kansas, Missouri fans excited for Border War renewal",David Medina,"2:09 PM, Dec 11, 2021 "
https://www.kshb.com/news/national/captive-medics-bodycam-shows-firsthand-horror-of-ukraines-mariupol,Medic's bodycam shows firsthand horror of Ukraine war,Scripps News Staff,"8:44 PM, May 19, 2022 "
https://www.kshb.com/news/national/people-travel-to-uvalde-from-far-away-to-help-community-heal-after-shooting,People travel to Uvalde from far away to help community heal,Chris Stewart,"3:36 PM, May 26, 2022 "
https://www.kshb.com/news/national/u-s-senate-candidate-who-suffered-a-stroke-also-has-cardiomyopathy,Senate candidate who suffered stroke also has cardiomyopathy,The Associated Press & Scripps National,"3:23 PM, Jun 03, 2022 "
https://www.kshb.com/sports/royals-acquire-lhp-reliever-amir-garrett-in-trade-with-cincinnati,Royals acquire LHP reliever Garrett in trade with Cincinnati,Tod Palmer,"1:12 PM, Mar 16, 2022 "
https://www.kshb.com/news/national/mutliplayer-focused-evil-dead-the-game-pays-tribute-to-horror-series,'Evil Dead: The Game' resurrects old horror franchise,Phil Villarreal,"10:41 AM, May 19, 2022 "
https://www.kshb.com/news/local-news/unified-government-to-consider-ordinance-allowing-for-municipal-ids,Unified Government to consider ordinance allowing for municipal IDs,Bryant Maddrick,"5:07 PM, Feb 10, 2022 "
https://www.kshb.com/news/national/nfl-to-appeal-ruling-in-gruden-lawsuit-over-leaked-emails,NFL to appeal ruling in Gruden lawsuit over leaked emails,The Associated Press & Scripps National,"6:04 PM, May 25, 2022 "
https://www.kshb.com/news/local-news/1-critically-injured-in-collision-on-cookingham-drive-near-105th-street-in-kansas-city,"1 critically injured in collision Friday in Kansas City, MO",Addi Weakley,"11:49 AM, Feb 25, 2022 "
https://www.kshb.com/news/national/bewitched-statue-in-salem-vandalized-with-red-paint,'Bewitched' statue in Salem vandalized with red paint,Scripps National,"4:09 PM, Jun 07, 2022 "
https://www.kshb.com/news/national/school-massacre-continues-texas-grim-run-of-mass-shootings,School massacre continues Texas' grim run of mass shootings,The Associated Press & Scripps National,"3:25 PM, May 25, 2022 "
https://www.kshb.com/weather/weather-blog-april-begins-with-a-freeze-a-storm-approaching,"Weather Blog: April begins with freeze, storm approaching",Gary Lezak,"7:31 AM, Apr 01, 2022 "
https://www.kshb.com/news/local-news/prosecutors-drop-child-abuse-charge-against-day-care-owner,Prosecutors drop child abuse charge against day care owner,Associated Press,"10:06 AM, Apr 14, 2022 "
https://www.kshb.com/news/national/finnish-swedish-leaders-to-visit-white-house-amid-nato-push,"Finnish, Swedish leaders to visit White House amid NATO push
",Justin Boggs,"9:35 AM, May 17, 2022 "
https://www.kshb.com/news/national/russia-ukraine-conflict/european-union-and-us-to-coordinate-efforts-to-control-negative-impacts-of-russias-war,"US, EU to work together to lessen Russian war's 'negative impact'",The Associated Press & Scripps National,"7:15 PM, May 16, 2022 "
https://www.kshb.com/lawsuit-accuses-wendys-mcdonalds-misleading-burger-size-ads,Lawsuit accuses Wendy’s and McDonald’s of misleading burger size in ads,Kaitlin Gates,"11:10 AM, May 19, 2022 "
https://www.kshb.com/news/national/texas-school-district-locked-down-amid-reports-of-shooter,"Authorities: Texas elementary school shooting kills 19 children, two adults",Scripps National,"12:59 PM, May 24, 2022 "
https://www.kshb.com/news/crime/family-of-man-shot-killed-on-train-in-lees-summit-suing-amtrak,Family of man killed on train in Lee’s Summit suing Amtrak,Addi Weakley,"11:35 PM, Mar 20, 2022 "
https://www.kshb.com/news/national/2-dead-after-single-engine-plane-crashes-in-colorado-neighborhood,2 dead after plane crashes in Colorado neighborhood,KMGH Staff,"1:13 PM, May 23, 2022 "
https://www.kshb.com/news/national/tennessee-suspends-grocery-tax-for-a-month-to-curb-inflation,Tennessee temporarily pauses grocery tax citing inflation,Scripps News Staff,"8:04 PM, Apr 12, 2022 "
https://www.kshb.com/sports/college-sports/ksu/kansas-state-puts-away-pitt-state-in-exhibition-play-78-59,"Kansas State puts away Pitt State in exhibition play, 78-59",Mick Shaffer,"9:48 PM, Nov 04, 2021 "
https://www.kshb.com/news/crime/kcpd-seeks-additional-witnesses-in-motorcyclists-shooting-death,KCPD seeks witnesses in motorcyclist’s shooting death,Tod Palmer,"9:56 AM, Feb 23, 2022 "
https://www.kshb.com/news/black-history-month/exploring-black-history-down-kansas-citys-african-american-heritage-trail,Walking down KC's African American Heritage Trail,Justin Yavorski,"4:00 AM, Feb 21, 2022 "
https://www.kshb.com/news/local-news/linn-county-ks-volunteer-firefighter-dies-from-injuries-sustained-while-fighting-blaze,Linn County volunteer firefighter dies after being injured while fighting blaze,David Medina,"3:59 PM, Jun 22, 2022 "
https://www.kshb.com/benefits-black-seed-oil-what-you-need-know,Benefits Of Black Seed Oil Have Earned This Supplement A Loyal Following,Emily OBrien,"1:55 PM, May 17, 2022 "
https://www.kshb.com/news/national/how-countries-like-the-uk-have-quelled-gun-violence,Other countries' gun violence solutions,Scripps News Staff,"8:48 PM, May 25, 2022 "
https://www.kshb.com/sports/huskers-ending-touchdown-balloon-release-due-to-helium-shortage,Huskers ending touchdown balloon release due to helium shortage,KMTV Staff,"4:56 PM, May 24, 2022 "
https://www.kshb.com/safe-sleep-babies-act-bans-padded-crib-bumper-pads-inclined-sleepers,"Safe Sleep For Babies Act Signed Into Law, Banning Padded Crib Bumper Pads And Inclined Sleepers",Tricia Goss,"8:15 AM, May 18, 2022 "
https://www.kshb.com/news/national/indiana-legislature-overrides-governors-veto-of-bill-banning-transgender-girls-from-sports,Indiana legislatures override veto of trans sports bill,WRTV Staff,"2:38 PM, May 24, 2022 "
https://www.kshb.com/news/national/tiger-woods-to-sit-out-u-s-open,Tiger Woods to sit out U.S. Open,Justin Boggs,"11:20 AM, Jun 07, 2022 "
https://www.kshb.com/sports/local-sports/high-school/kansas-city-high-school-football-podcast-week-3,Kansas City High School Football Podcast: Week 3,Mick Shaffer,"12:58 PM, Sep 09, 2021 "
https://www.kshb.com/entertainment/moss-to-testify-in-depps-libel-lawsuit,Moss to testify in Depp's libel lawsuit ,Sarah Dewberry,"5:47 PM, May 23, 2022 "
https://www.kshb.com/news/national/uvalde-native-matthew-mcconaughey-addresses-mass-shooting-in-hometown,McConaughey addresses mass shooting in hometown,Tatiana Salazar,"9:49 AM, May 25, 2022 "
https://www.kshb.com/news/national-politics/the-race/what-the-rising-age-of-americas-dams-means-for-the-future,What the rising age of America's dams means for the future,Chris Stewart,"1:19 PM, May 27, 2022 "
https://www.kshb.com/news/national/north-korea-confirms-21-new-deaths-as-it-battles-covid-19,North Korea confirms 21 new deaths as it battles COVID-19,The Associated Press & Scripps National,"8:31 PM, May 13, 2022 "
https://www.kshb.com/news/crime/1-killed-in-multi-vehicle-accident-in-kansas-city-kansas,"1 killed in multi-vehicle accident in Kansas City, Kansas ",Addi Weakley,"11:21 PM, Jan 30, 2022 "
https://www.kshb.com/news/national/jan-6-committee-to-hold-prime-time-hearing-next-week,Jan. 6 committee schedules public hearing for June 9,Scripps National,"5:08 PM, Jun 02, 2022 "
https://www.kshb.com/news/national/queen-elizabeth-ii-to-miss-jubilee-service-amid-discomfort,Queen Elizabeth II to miss Jubilee service amid 'discomfort',The Associated Press & Scripps National,"4:46 PM, Jun 02, 2022 "
https://www.kshb.com/news/crime/no-one-was-injured-following-saturday-night-kcpd-officer-involved-shooting,KCPD officer opens fire on suspect; no injuries reported,Casey Murray,"8:46 AM, Feb 27, 2022 "
https://www.kshb.com/news/local-news/kcmo-police-request-help-locating-missing-endangered-man,"KCMO police locate missing, endangered man",Jack Anstine,"11:50 AM, Jan 22, 2022 "
https://www.kshb.com/news/national-politics/biden-slams-scotus-ruling-on-texas-abortion-law-vows-whole-of-government-response,Biden vows whole-of-government response to TX abortion law,Alex Hider,"12:28 PM, Sep 02, 2021 "
https://www.kshb.com/news/national/gasbuddy-national-average-price-of-gas-reaches-5,GasBuddy: National average price of gas reaches $5,Tatiana Salazar,"8:29 AM, Jun 09, 2022 "
https://www.kshb.com/news/national/runner-collapses-dies-after-brooklyn-half-marathon,"Runner collapses, dies after Brooklyn half-marathon",The Associated Press & Scripps National,"10:34 AM, May 23, 2022 "
https://www.kshb.com/news/local-news/joplin-police-officer-released-from-hospital-after-surviving-shooting,Joplin police officer released from hospital after shooting,Katharine Finnerty,"12:42 PM, Mar 16, 2022 "
https://www.kshb.com/weather/weather-blog-tracking-2-3-storm-systems,Weather Blog: Tracking 2-3 storm systems,Jeff Penner,"8:40 AM, Apr 02, 2022 "
https://www.kshb.com/news/crime/man-killed-outside-independence-gas-station,Man killed outside Independence gas station,Jamie Peters,"3:04 AM, Mar 30, 2022 "
https://www.kshb.com/news/coronavirus/leavenworth-county-has-low-covid-19-community-rate-despite-cdc-map,Leavenworth County: CDC map doesn't tell the whole story,Emma James,"5:38 PM, Mar 22, 2022 "
https://www.kshb.com/sports/sporting-kc/sporting-kc-president-ceo-jake-reid-signs-5-year-extension,"Sporting KC President, CEO Jake Reid signs 5-year extension",Tod Palmer,"4:13 PM, Mar 02, 2022 "
https://www.kshb.com/news/local-news/crash-involving-kcpd-vehicle-critically-injures-1-person,2 people hurt in four-vehicle crash in KCMO,David Medina,"6:06 PM, Feb 23, 2022 "
https://www.kshb.com/news/local-news/american-automobile-association-suggests-changing-driving-habits-to-conserve-gas,AAA suggests changing driving habits to conserve gas,Megan Abundis,"9:29 PM, Mar 08, 2022 "
https://www.kshb.com/news/national/golden-state-warriors-head-coach-steve-kerr-makes-impassioned-remarks-after-texas-school-shooting,Golden State Warriors' Steve Kerr on Texas shooting:  'We can't get numb to this',Douglas Jones,"9:05 PM, May 24, 2022 "
https://www.kshb.com/sports/college-sports/ksu/bill-snyder-talks-legendary-career-as-kansas-state-university-head-football-coach,Bill Snyder talks legendary career as K-State football coach ,McKenzie Nelson,"5:42 PM, Mar 10, 2022 "
https://www.kshb.com/cookie-banners-annoying-block-them,Cookie Banners Can Be Annoying—Here’s How To Block Them,Tricia Goss,"6:30 AM, May 24, 2022 "
https://www.kshb.com/weather/increasing-clouds-with-a-chance-of-showers-and-thunderstorms-after-5-pm,Drying out overnight with sunshine returning Monday,Gary Lezak,"7:00 AM, Apr 03, 2022 "
https://www.kshb.com/news/local-news/parkville-woman-identified-as-victim-in-fridays-deadly-i-70-crash,KHP IDs Parkville woman as victim in deadly I-70 crash,Megan Abundis,"11:38 AM, Mar 21, 2022 "
https://www.kshb.com/clever-ways-get-rid-ants-your-home,Try these 4 clever ways to get rid of ants in your home,Kathleen St. John,"8:55 AM, May 23, 2022 "
https://www.kshb.com/news/national/epa-moves-to-give-states-tribes-more-power-to-protect-water,"EPA moves to give states, tribes more power to protect water",The Associated Press & Scripps National,"3:06 PM, Jun 02, 2022 "
https://www.kshb.com/rearrange-every-piece-small-sectional-sofa,You Can Rearrange All Of The Pieces Of This Top-Selling Small Sectional Sofa,Anna Weaver,"9:55 AM, May 19, 2022 "
https://www.kshb.com/news/national/1st-covid-19-shots-for-kids-under-5-could-be-available-by-june-21,COVID shots for kids under 5 could be available this month,The Associated Press & Scripps National,"2:25 PM, Jun 02, 2022 "
https://www.kshb.com/news/local-news/kansas-city-organizations-team-up-for-donation-drive-that-ends-saturday,KC organizations team up for donation drive,Dan Cohen,"4:00 AM, Oct 22, 2021 "
https://www.kshb.com/sports/local-sports/high-school/kansas-city-high-school-football-podcast-week-6,Kansas City high school football podcast: Week 6,Mick Shaffer,"4:32 PM, Sep 30, 2021 "
https://www.kshb.com/news/national/texas-memorial-grows-to-give-family-and-friends-of-uvalde-victims-a-place-to-mourn,"Uvalde, Texas memorial: Family, friends of victims have a place to mourn",Chris Stewart,"4:30 PM, May 27, 2022 "
https://www.kshb.com/news/national/mountain-lion-transported-to-zoo-after-wandering-into-california-high-school,Mountain lion transported to zoo after wandering into California high school ,Sarah Dewberry,"12:06 PM, Jun 02, 2022 "
https://www.kshb.com/news/crime/2nd-person-charged-in-october-2021-triple-homicide,2nd person charged in October 2021 triple homicide,Katelyn Brown,"12:14 PM, Mar 02, 2022 "
https://www.kshb.com/news/national/technology-can-help-keep-parkinsons-patients-on-their-feet-and-control-freezing-gait,"Cues can help those with ""freezing gait,"" caused by Parkinson's",Bo Evans,"5:02 PM, May 12, 2022 "
https://www.kshb.com/news/national/poloncarz-911-dispatcher-who-acted-totally-inappropriately-placed-on-administrative-leave,Authorities: Buffalo 911 dispatcher acted 'inappropriately' ,WKBW Staff,"3:47 PM, May 18, 2022 "
https://www.kshb.com/news/national/3-officers-shot-during-school-shooting-released-suspects-grandmother-remains-hospitalized,3 officers shot during school shooting released,Justin Boggs,"7:23 AM, May 26, 2022 "
https://www.kshb.com/money/consumer/dont-waste-your-money/family-denied-cruise-boarding-for-incorrect-birth-certificate,Family denied cruise boarding for incorrect birth certificate,John Matarese,"5:00 AM, May 23, 2022 "
https://www.kshb.com/news/national/us-agrees-to-update-critical-habitat-for-florida-manatees,US to update critical habitat for manatees,The Associated Press & Scripps National,"10:43 AM, Jun 02, 2022 "
https://www.kshb.com/news/national/federal-appeals-court-rules-secs-in-house-judges-violate-defendants-rights,Federal appeals court rules SEC's in-house judges violate defendants’ rights,Scripps National,"3:23 PM, May 19, 2022 "
https://www.kshb.com/news/national/russia-ukraine-conflict/zelenskyy-says-ukraine-demands-russia-be-held-responsible-for-financial-damage-to-his-country,Zelenskyy: Ukraine demands Russia held financially responsible for war,The Associated Press & Scripps National,"9:12 PM, May 20, 2022 "
https://www.kshb.com/news/local-news/study-10-more-minutes-of-daily-exercise-could-prevent-110-000-annual-deaths,"Study: more exercise could prevent 110,000 annual deaths",Charlie Keegan,"4:00 AM, Mar 31, 2022 "
https://www.kshb.com/news/national/russia-ukraine-conflict/red-cross-president-calls-out-double-standard-of-europes-acceptance-of-migrants-amid-ukraine-war,Humanitarian chief calls out Europe's 'double standard' on migrants,The Associated Press & Scripps National,"10:05 PM, May 16, 2022 "
https://www.kshb.com/news/local-news/kc-police-academy-physical-training-and-defensive-tactics,KC Police Academy: physical training and defensive tactics,Emma James,"7:05 PM, Feb 24, 2022 "
https://www.kshb.com/news/national/husband-of-teacher-killed-in-texas-school-shooting-dies-from-heart-attack,Husband of teacher killed in Texas school shooting dies,Scripps National,"2:05 PM, May 26, 2022 "
https://www.kshb.com/prepare-compliments-when-you-wear-this-42-wide-leg-romper-summer-parties,Prepare for tons of compliments when you wear this $42 wide-leg romper to summer parties,Kaitlin Gates,"11:40 AM, May 12, 2022 "
https://www.kshb.com/sports/chiefs-reportedly-agree-to-terms-with-wr-marquez-valdes-scantling,Chiefs sign former Green Bay WR Marquez Valdes-Scantling,Tod Palmer,"3:23 PM, Mar 24, 2022 "
https://www.kshb.com/news/crime/1-police-officer-killed-1-injured-following-motel-6-incident-in-bonne-terre,"1 police officer killed, 1 injured in Bonne Terre",Casey Murray,"5:56 AM, Mar 17, 2022 "
https://www.kshb.com/mylan-epipen-class-action-settlement-file-claim,There’s another EpiPen class-action settlement—here’s how to file a claim,Kathleen St. John,"8:40 AM, Jun 01, 2022 "
https://www.kshb.com/news/local-news/gallery-communities-rally-amid-midwest-tornado-damage,PHOTO GALLERY: Communities rally amid Midwest tornado damage,,"8:39 AM, Dec 12, 2021 "
https://www.kshb.com/news/local-news/union-stations-auschwitz-exhibition-departs-this-sunday,Union Station's Auschwitz exhibition departs this Sunday,Dan Cohen,"7:52 PM, Mar 15, 2022 "
https://www.kshb.com/news/local-news/it-was-a-sea-of-jayhawks-fans-at-power-light-react-to-ku-winning-big-12-tournament,KU fans react to Jayhawks winning Big 12 Tournament ,Leslie DelasBour,"11:12 PM, Mar 12, 2022 "
